<?xml version="1.0" encoding="UTF-8"?>
<libreria xmlns:xsi="http://www.w3.org/2001/XMLSchema-instance" xsi:noNamespaceSchemaLocation="DAM1_PR-Final_LM_230601_Alejandro_Vargas.xsd">
  <libro año="2018">
    <categoria>Ficción</categoria>
    <titulo>Libro de Ficcion 1</titulo>
    <autor>Autor 1</autor>
    <precio cantidad="30.14">
      <euros/>
    </precio>
  </libro>
  <libro año="2078">
    <categoria>Ficción</categoria>
    <titulo>Libro de Ficcion 2</titulo>
    <autor>Autor 2</autor>
    <precio cantidad="12.80">
      <euros/>
    </precio>
  </libro>
  <libro año="1845">
    <categoria>No Ficción</categoria>
    <titulo>Libro de No Ficcion 1</titulo>
    <autor>Autor 3</autor>
    <precio cantidad="92.00">
      <dolares/>
    </precio>
  </libro>
  <libro año="1998">
    <categoria>No Ficción</categoria>
    <titulo>Libro de No Ficcion 2</titulo>
    <precio cantidad="82.68">
      <dolares/>
    </precio>
  </libro>
</libreria>
